id,currentAnswer,title
0x3fc866e4c1c33ccb3baf2bf9042f281575773f44,No,Will Russia succeed in rejoining the UN's human rights council by 30 September 2023?
0x3fcb67401438b2919a008889cc7fb328c1b17220,No,"Will Apple, Google, and Comcast successfully implement L4S to fix internet lag by 18 December 2023?"
0x3fdde11eb91718279dcadb539e25db748140aa8f,Yes,Will there be a crossover game featuring Cult of the Lamb and Don’t Starve Together by 27 August 2023?
0x3ffe09ca1581cb5cb29ad2a1bdabf9a20c1bb330,No,Will the U.N. Security Council vote in favor of aid for Gaza on 30th December 2023?
0x4016c5dd3b8e739858011ca35ebe86ee908a366a,Yes,Will Israeli forces launch a ground offensive in Gaza by 21 October 2023?
0x405ca27762b06c7b0810caad8b3b60c6835c7f0f,No,Will TikTok users in the European Union be able to switch off the content-selection algorithm by 21 August 2023?
0x405d30ccd02258ea63b63d14744a23f3a3445354,No,Will the law limiting the power of Israel's Supreme Court be approved by 16 September 2023?
0x405ea9fbbe38a4015120c809547f5df6cc938031,No,Will a new version of Microsoft Windows be released on 23 November 2023?
0x407a7087e9f831d62520ea4c6a8c0a26218ef049,No,Will the Lahaina wildfire death toll reach 100 by 28 October 2023?
0x40a36e840c373ba5beb4022e479b7919ef61e73d,No,Will the New York subway's ride tracker security loophole be fixed by 5 September 2023?
0x40af74f7308bd5e4b4f9e16eb9abfcddcf749880,Yes,Will Sharknado's theatrical re-release occur on or by 19 August 2023?
0x4110ced8c88d93e9168b63d6e23a083a2212d0eb,No,Will relations between North Korea and South Korea improve by 29 September 2023?
0x4113905f925227877b954f032dee920828d24c7e,No,Will England win another Women's Nations League match on 11 December 2023?
0x415fbc5bc0cc7e4917900a9f2662b7dfc5e236c0,No,Will all users of social media platform X have to pay for access by 23 September 2023?
0x41628d05d94a802dc165d79f55df299ed3c20605,Yes,"Will there be snowfall in Iowa on December 4, 2023?"
0x417a34c5bba9ddeabb7048f8b8802d84c0228cf1,No,Will Rex Heuermann's trial be concluded by 22 November 2023?
0x418156da7bf497830139e877d9e4c9a828f7804b,No,Will the suspect responsible for the shooting near Morgan State University be found by 9 October 2023?
0x418f31997f1112f7ea2f065807bd86935fea7032,No,Will a new indie game for Nintendo Switch be released by 14 August 2023?
0x419474bc7610f23bc193e9b76bbb890695deccae,Yes,Will the referendum to recognize Australia's Indigenous people in the constitution pass by 21 September 2023?
0x41ad9d737fbd4ebea6adbef5e54c863a353cdb0f,No,Will Devon Lara Lucas release a new board game on 3 August 2023?
0x41e2ca783516a93ad01dfa1ff4b56a965c067b79,No,Will the New England Patriots win their next match against the Pittsburgh Steelers on 16 December 2023?
0x422c61a2d32b89f124cc4256704e1611724c2ac6,Yes,Will the Hollywood actors' strike officially end by 14 November 2023?
0x42604a15d5c7af14f203936884e941c2f71ec895,No,Will Cole Palmer score a goal for Chelsea on 22 November 2023?
0x426a8ec1becca9d7dbb329fcdb81e821c52428e5,Yes,Will Chevron's Wheatstone facility in Australia resume its full LNG production by 20 September 2023?
0x426ba32db1768371096d1549ecdef979ea12e798,Yes,Will Vikings' quarterback Kirk Cousins be confirmed to miss the rest of the season due to an Achilles injury by 7th November 2023?
0x426e7d059388837a01344860456a8d6bb1a6b464,Yes,"Will the 128-year-old mummy, 'Stoneman Willie', finally get a funeral by 7 October 2023?"
0x42d46989870a0ad27ce60a1d4f447d1113ee16b2,No,Will Dell's XPS laptop line up change be officially announced by 9 January 2024?
0x42fe3f3bc5425e53e79c45b69cdf3fc42a5f07cf,Yes,"Will Robert De Niro's production company pay $1.2 million to a former employee by November 19, 2023?"
0x436b86cd120337bb2a3f9730926c703451f7c158,No,Will Grimes release a new AI-generated piece of music by 18 August 2023?
0x437f33931e85a22993ad53fefb39e2ed1e5c5b40,No,Will A$AP Rocky be found guilty in his trial by 29 November 2023?
0x4394d50fec4eda8580c513a83b79d4c46bfc3e2f,Yes,Will a new season of the Netflix show 'Wednesday' begin production by 8 January 2024?
0x43d08dea91d9d989410f65e725f377b567aabf9a,Yes,Will the Super Mario Bros. Movie be available on Peacock on 17 August 2023?
0x43f7071b3caadd46c3c045c30d01baf922bf01e6,No,Will New Orleans' Facial Recognition Systems lead to any arrests by 9 August 2023?
0x4476696266090114656ec938577a9c4fcba89f0e,No,Will Hamas release all hostages by 18 December 2023?
0x448ea90aeaba621a8582495d3d77337235cb770e,No,Will the SAG-AFTRA new contract regarding the use of artificial intelligence be approved on or by 28 November 2023?
0x44927d56b8caad819e662cba506cbfe7d7685e71,Yes,Will Head Start teachers receive a pay raise by 23 November 2023?
0x44c3c5ac2cf1d068514025d7288d32ed37ec728a,No,Will Threads reach 1 billion users by 9 August 2023?
0x44c6c9de42291bce92d3837c7b79d83adbd020fc,No,"Will US job openings increase by 18 December 2023, following the low levels reported in October?"
0x452aa2401164e8224ffb8bd2457d8498ecdb2e20,Yes,Will Bayer Leverkusen maintain their top position in Bundesliga on 3 December 2023?
0x4570322b9eef4c0770e7f2713b486fccd838d757,No,Will the Powerball jackpot be won by 6 October 2023?
0x45a7832bbf28fcab90f9f88c1ea4a58039cd57ae,No,Will the 30-year fixed mortgage rate in the US reach 9% by 29 October 2023?
0x45db686a5f7c4af67e2eca43b89e7ca560393b3c,Yes,Will Dolly Parton perform another surprise concert for a terminally ill fan on 7 January 2024?
0x4618e6acdea1057e8a7800c7f3ae37ab535c30c5,No,Will Congressman Henry Cuellar's carjacker be caught by 7 October 2023?
0x46458b03ee31ef592f9434af59232baa0e5f06bf,No,Will South Africa be found to have supplied arms to Russia by 9 September 2023?
0x466cc5e2d406506dd4a49989276cd62f4057fa54,Yes,Will Disney start a new building project by 6 December 2023?
0x468c847ff5efe15de041303f5a9f470ad8840e79,Yes,Will Michigan win the national title on 7 January 2024?
0x474d4ba2121f77693c2eb98b96cdbaf8ec8bccdb,Yes,Will all nine teenagers who fled from the Pennsylvania juvenile detention center be found by 22 September 2023?
0x47aef552e1a092973e7b42b6d3012103c64b520b,No,Will Hunter Biden's tax-related charges be fully resolved by 17 December 2023?
0x47b97883ec2b3870e3ddef0eab3cbb1fd965a055,No,Will the death toll from the Mbankolo landslides in Cameroon exceed 40 by 18 October 2023?
0x47fffb7d747cf4b7f65337e725ab4b247d8055ad,Yes,Will Julius Malema remain the leader of South Africa's second-largest opposition party on 16 August 2023?
0x481378185621968bfdd617d99517373de71bf148,No,Will Luis Diaz's kidnapped father be found by 7 November 2023?
0x488c53f681e62403416be8d1c2dfe80361631bc4,No,Will the WGA and the AMPTP reach an agreement by 19 August 2023?
0x488f8e8b894e023df93fb3009cc47e8faf0d6537,No,Will the Star Wars series 'Ahsoka' release a new season on or by 6 September 2023?
0x48a6e588ecb35229f57d7b3057c8ab8844236410,No,Will the situation in Gaza escalate to a full-scale war involving Venezuela by 21 October 2023?
0x48b2db9fae8ebe9f6ac938ea5f9a121945d97512,No,Will the Biden Administration announce another gift to U.N. Green Climate Fund on 12 December 2023?
0x48f73b9c7f7adc60f715c5b426f250dd6a374ea8,No,Will the couple involved in the Bitfinex hack be sentenced by 9 August 2023?
0x491ca0ee01b7ee1b5a05db9b6992d4d134bc032a,No,"Will Amazon be found guilty in the landmark monopoly case by October 1, 2023?"
0x496dd220935654f342fa4c51bfe563053c0c4bad,Yes,Will Sam Bankman-Fried be found guilty in his fraud trial on or by 4 November 2023?
0x499891f815ab8fc637a553914411a21a2e774c07,No,Will Dropbox reinstate its unlimited cloud storage plan by 3 September 2023?
0x49d45ce4e3f37688de65cba6efb64ef12835b858,No,Will Country Garden meet its offshore payments deadline on 14 October 2023?
0x49e13a2fcf4f4a8ffa15ea656bae2a1e30217351,No,Will Polestar completely switch to Tesla's EV charging standard by 6 August 2023?
0x49ecde9de4ba762cd85c70bedea3ba83089b716b,No,Will Elon Musk announce any regulation on Artificial Intelligence by 19 September 2023?
0x49fd20cd63d7c342eab89d200af9f4512c70ea4f,Yes,Will the Group of Seven industrial countries implement a code of conduct for companies developing advanced artificial intelligence systems by 6 November 2023?
0x4aa46e3a442ff5be296a72e22d17d0a7f4c6c53b,No,Will there be another major attack on an Israeli-owned ship in the Indian Ocean by 3 December 2023?
0x4adf76a66225fc8f76278fb382e27a282c5affe2,No,Will the production of the Interview With the Vampire series be completed by 8 September 2023?
0x4afb0dee90020f72a3960b39d26f8106425fb500,Yes,Will Tweetdeck become part of the paid Blue subscription by 27 August 2023?
0x4b845653a03dbb7c1c1e12acae79092560c0f142,Yes,Will Donald Trump announce his candidacy for the 2024 Republican presidential nomination by 2 October 2023?
0x4bb42f8c76a55695234f37cefc7a3e3851c262e6,No,Will Elizabeth Holmes be released from prison by 8 August 2023?
0x4bdbfeafd4f5ce22bce1423c4f0912e03e6bad4f,No,Will Xbox Cloud Gaming on Meta’s Quest VR headsets be available for all users by 22nd December 2023?
0x4bf81097ae9a561e19e572d43562037dcd23e917,No,Will Donald Trump win the GOP nomination for the 2024 Presidential election on 18th December 2023?
0x4c103b0e6fc2a7b845fbccc1f1407e05dfa186e5,Yes,Will the Zimbabwe election result be announced by 26 August 2023?
0x4c3572d36e288f6cc38c70d7e8ee35b41b0af288,No,Will Rudy Giuliani face legal charges for the alleged groping incident mentioned in Cassidy Hutchinson's new book by 25 September 2023?
0x4c45bc69d9b55dc405c8510a4251eef742d9cef9,Yes,Will the 30-year fixed mortgage rate exceed 8% on 27 October 2023?
0x4c5cc051879e46906468ecfb595b967a8c6533cd,No,Will Epic Games have any adults-only rated blockchain games available on their marketplace on 28 December 2023?
0x4c795013c82e2525792824333a32423a271647db,Yes,"Will Google Pixel 8 Pro release an updated version of its video boost feature by January 1, 2024?"
0x4ca1967efa1aba5cbc1a51e8ec5293daad60dd1a,No,"Will Bored Ape Yacht Club successfully block OpenSea over payment disputes by August 24, 2023?"
0x4cbc403623dffef8a63904044f4489d34425ba8d,No,Will the Barbie movie officially start showing in Russia on 2 October 2023?
0x4cc2d11a39b84ff994e1a0687e8c3e9a9f53627b,No,Will Apple withdraw iPhone 12 from the market by 17 September 2023 due to high radiation levels?
0x4d1d5ce0ef53caf6969125dd3b43fe5b38a14724,No,Will Daniel Johns reconcile with his Silverchair bandmates by 29 September 2023?
0x4d7ebcd942861496d0506c56104f60af8928030b,No,Will former Texas Rep. Will Hurd re-enter the 2024 presidential race by 17 October 2023?
0x4d9b3ed0dc2486f5ba6b64e00cc4e9fe7961b15c,No,"Will the Supreme Court rule on the $15,000 IRS bill dispute by 21 October 2023?"
0x4ddd1c0239c536f7fc1b73d8bf7de6788895cee0,No,Will Mophie release more than three Qi2 magnetic wireless chargers by 8 September 2023?
0x4e29bea37f381914d1dec414db5ed2a8de17abea,Yes,Will Dropbox end its unlimited cloud storage plan by 31 August 2023?
0x4e30a515b59ba7f1cd1c390a067f095ad087ab3d,No,Will the Euro reach parity with another major currency by 8 October 2023?
0x4e34eb7dd4861992d98086407ec66b0be2e880c4,No,Will India expel another Canadian diplomat on 23 September 2023?
0x4e49693373cfd7b273b3379733ef03e4fe545a12,No,Will the Vatican make any changes to its statement on transgender people's rights in the Roman Catholic Church by 16 November 2023?
0x4e772af842658e4298d2f9f033f83985804521e6,No,"Will the US House of Representatives successfully avert a government shutdown by November 20, 2023?"
0x4ef7e584c6f39bd591f5ff3a344ac8d3dbaaa210,No,Will the shortage of ADHD medication be resolved by 1 September 2023?
0x4f319985cd2682467a81ed123004b077ed257003,No,Will Meta Platforms' paid ad-free service be banned in Austria as a result of the privacy complaint by 7 December 2023?
0x4f7280fe39e0a07b516fbe46f5c3b1fe4639056e,No,Will Geoffrey Hinton publish a new research paper on AI by 4 August 2023?
0x4f7f73d1d3eb55bbbb87d1040e1b18308d61212e,No,Will the series 'Scott Pilgrim' and 'The Last Airbender' be released on Netflix's Geeked Week 2023 by 25 October?
0x4f88c9ca45513df50ca726592ff3fe3ce5ba8bde,No,Will Adobe announce a successor for Dr. John Warnock by 29 August 2023?
0x4f89127d6acccf31c032d86a18334b09df11b1b1,No,Will Elon Musk issue a public apology for his antisemitic 'actually truth' post by 26 November 2023?
0x4fb47ef14c3a575cf66b15b2bd7a0c61e37f4fff,No,Will Google's Gemini AI project be officially launched by 26 November 2023?
0x4fb558e74152a6b573a940609d7b2c57ad03507b,Yes,Will Italy win another Davis Cup title by 4 December 2023?
0x4fb8c66cb3b4777999a82ba8ce27326c0cc5aaf5,No,Will Prime Video reconsider its decision and renew 'The Peripheral' for a second season by 26 August 2023?
0x4fe271990f23a91d722b06de6f0e81970c5540ff,No,"Will Instagram issue a statement addressing the arrests related to posts about a 17th-Century King in Maharashtra, India by 2 August 2023?"
0x50702fe153e92f2e791c78ef3f114461882b734a,Yes,Will Apple co-founder Steve Wozniak be discharged from the hospital in Mexico City by 14 November 2023?
0x5074c1cb42fb101d52aaa99cdb4285cc4e351285,No,Will shares in Evergrande remain suspended on 4 October 2023?
0x5077ff2c41066de95c00320a0d2cd94c43c3909b,No,Will MrBeast win the lawsuit against his fast food chain by 14 August 2023?
0x5080c43775dafbb00c449988dcdd8043892468fc,Yes,"Will the stage of St George's Guildhall in King's Lynn, where William Shakespeare would have performed, be officially recognized by 10 October 2023?"
0x5092ea13c0ee6a51577293e8c91dba4723ba74cb,Yes,"Will Argentina's President-elect Javier Milei visit Israel and the United States before his inauguration on December 10, 2023?"
0x50aacb4b236ba3bf523ca4d956be9874a9d28812,Yes,Will Sir Jim Ratcliffe increase his stake in Manchester United beyond 25% by 3 January 2024?
0x50e4c6c9b10549cd1bc2d78ee35edec52d54c574,No,Will Sweden's NATO membership bid be ratified by Turkey's parliament by 30 October 2023?
0x50ef1dbe013ea2299dbddde813ea6dcc881afe59,Yes,Will flights to Israel by major airlines remain suspended on 16 October 2023?
0x50f60c3ad155976e4889502d860f927f4894a165,No,Will there be a ceasefire in the Israeli-Hamas conflict by 16 October 2023?
0x50f6f8ceabe434a6334911572458d37d2de9b886,Yes,Will Voyager 2 send back new information from outside the solar system on 15 August 2023?
0x514294b35a9b87e312af0c26b6517c9ba35ac38f,No,Will Omar Abbosh be the CEO of Pearson by 24 September 2023?
0x5170f9eae4b4d8df83a14dc5ace2ec0a56057f69,No,Will Shein successfully go public in the United States by 5th December 2023?
0x51a05c1f72953008082584154a24c7a2f5243828,Yes,Will any Australian city host pro-Palestinian rallies by 20 October 2023?
0x51a5d5975aaad241eca901cfd8019d25f7574694,No,Will HSBC complete the acquisition of Citigroup's China consumer wealth management business by 3 October 2023?
0x51c676ce199830ea261360b9ed56a8efecb268e1,No,Will the Indian Supreme Court rule in favor of same-sex marriage by 23 October 2023?
0x51fab28bbffb06868515a16a9f402936bd3a2a8f,Yes,Will Joe Biden introduce new policies or regulations concerning artificial intelligence by 8 November 2023?
0x52175664154c16c5abf0c3629da3444abc7a2957,No,Will the University professors in Texas win the lawsuit against the state over TikTok ban on 10 August 2023?
0x52241bf062c4745e6cbbfb6faabf17db65046cae,No,Will the manhunt for the suspect in the fatal shooting of a Maryland judge be concluded by 29 October 2023?
0x52585b1b09004301112bc754e1ee8090e5ab056f,No,Will Harvard University take action against the pro-Palestinian statement from students on 19 October 2023?
0x52be114710ff1b21cb91f32fbf877b5055c7fcf2,Yes,Will Linda Yaccarino still be the CEO of X on 27 November 2023?
0x52bfa385e787aa75de4dc34abcae6f7f6769713f,Yes,Will Moody's upgrade China's credit outlook to stable or positive on 25 December 2023?
0x52c110f8a33527db6f448e2c78a3ffe857480bde,No,Will the Samsung Galaxy Book 4 be officially launched by 12 December 2023?
0x531312137b2316e6ddf4ccaec56f928bd86caded,No,Will American Airlines take disciplinary action against the baggage handler involved in the viral video incident by 28 November 2023?
0x5319d0277cdb2dff34373ab96eb07cb90b94f4cf,No,Will Peloton recover from its subscriber and financial backlash by 1 September 2023?
0x5323d9bcc384ac4f53481226d7df0016c20d22ee,No,Will the NFL ban the hip-drop tackle on 29 November 2023?
0x53301cd02004a46cc0be82d7ca1996c80ecc82c1,Yes,Will the Bank of Japan raise its negative benchmark interest rate on 24 December 2023?
0x535a67198836fa27b5b4c2d3a9619d3233a1fdcc,No,Will American Airlines flight attendants go on strike on 27 November 2023?
0x5388e9e00471370097bc39e2256a76fccffaa1b2,Yes,Will all individuals be rescued from the Santa Cruz church collapse in Mexico by 6 October 2023?
0x53ad10721ff66126dc25e47246e6e2309a0893d7,No,Will Virgin Atlantic operate another flight using 100% sustainable aviation fuel on or by 7 December 2023?
0x54256287d7e70a10ad1a6c2bafabc0593f8b4be2,No,Will Ukrainian forces retake the city of Bakhmut by 18 August 2023?
0x5439d0e120afacdcad672a881eb06b3b7b8d3980,No,Will AMD's Ryzen 5 5600X3D be available at other retailers besides Micro Center by 2023-08-01?
0x545c2689cec9e4e1ad8399b6e7eccaea7ffcd690,Yes,Will Google's Bard be available to teens on 25 November 2023?
0x5466670579aa2bf73c1b537a49e55d232cd2629f,No,Will Geoffrey Hinton release a new research paper on AI by 13 August 2023?
0x54a563f2ba6986473fee3918e5b2b2058b077f00,Yes,Will Twitch allow streamers to simultaneously stream on any service they want on 27 October 2023?
0x54be122da8ea70ed93cccad32a37449a7e602f5b,No,Will Sam Bankman-Fried be convicted in his ongoing case by 22 October 2023?
0x54d912f3efea303085c6b0fce99d1965f22d5d49,No,Will Wyoming proceed with the auction of the large piece of land inside Grand Teton by 16 December 2023?
0x54e857aa4b6a455a7195449f8d2e1b3648aaa8fa,No,Will Meta's Quest 3 Headset be launched by 31 August 2023?
0x54eef6b80c269f82298388fc26810d82d1ba6500,Yes,Will the Noiselab Music Production Hub subscription price remain at $59.99 by 29 August 2023?
0x553265db15cd6fe13660732ad084e6abcb61a70b,No,Will Verizon have completed its major upgrade to rural 5G by 21 August 2023?
0x5558a564e12e58391b29f967c93d564a4ea1b3b5,No,Will Mark Zuckerberg's Meta win the lawsuit filed by 42 U.S. states for harming young people with addictive Facebook and Instagram features on 2 November 2023?
0x558939f74793ffbcb5eadd7d08dbf86847a645ae,Yes,Will the ChatGPT app for Android have more than 1 million downloads on 11 August 2023?
0x5638922b1c616a415249d1a7b495026444d954be,No,Will PayPal's PYUSD stablecoin be officially recognized by the US Federal Reserve by 21 August 2023?
0x564a3b6cbb3de493557d80028ec4a86704f04cb0,No,Will the senior Baton Rouge officer be reinstated on or before 2 October 2023?
0x56941d7aea055663cb1debd65b5c16bf82de9b12,No,Will the alleged Rwandan serial killer be convicted by 11 September 2023?
0x56b66b7b685e91bdd34de18ba506bd236c3ae7f3,No,"Will Amazon announce a successor for Dave Limp by August 22, 2023?"
0x56d7e5eefa1e324fd4800b1370a1460d760c9235,No,Will Fortnite publisher Epic Games win the lawsuit against Google on 9 December 2023?
0x57345c25d210f44ae44736f64d589854476653ad,No,Will Jennifer Aniston post another tribute to Matthew Perry on Instagram by 24 November 2023?
0x57357eb0219c2bb94c58a9755b6a4d3c2ccce967,Yes,Will a new game of Quordle be released on 18 December 2023?
0x57385c52b11de2f0a5aa3352cb75ecdb39ab377d,No,Will Blizzard release a new patch for Diablo IV on 10 August 2023?
0x5748663a3fcbe8a7c3ea6ad278914920567d0dff,No,"Will a new Speaker for the US House be elected by October 9, 2023?"
0x578dc021da61ce067f42efa53157f5f6ba4d8805,Yes,Will Google's AI tool 'Genesis' be able to generate news articles by 8 August 2023?
0x5793076d1e581f8000ee07ef5311b8bb1b7b0d98,No,Will the Apple Magic Keyboard Folio for iPad (10th Gen) increase in price by 13 September 2023?
0x57c5ce485b5be37b06f5d1533e954398515b93a3,No,"Will the 'Jalapeño Gate' controversy be resolved by August 27, 2023?"
0x57d82b6638e7a25ce2831b5d9e48a4b41e4fbf18,No,Will Dead Space remake be available on Xbox Game Pass on 23 October 2023?
0x57f1584e27d2ff83106e12b1d8ca4db0dd5540ae,Yes,Will Munich flights and trains resume normal operation on 12 December 2023 after heavy snowfall?
0x580dd7fbaf3ab8a48b9f33d1bd5d46b1e9ec1652,Yes,Will the large fire at the chemical plant near Houston be extinguished by 16 November 2023?
0x58151787138d83d73b105e058e1e86c6fd27ee4b,No,Will Lizzo face any legal consequences due to the new allegations against her by 18 August 2023?
0x58331b46818f11aa31a8b792eb9c08ed7a19d1b1,No,Will the Nothing Phone (1) receive another OS update on 2 September 2023?
0x58555c6f47acc9fd9027ba18bcd7324494ba58fb,Yes,Will Facebook successfully reenter the Chinese market by 17 November 2023?
0x588f2630274c689b3f682ef2e61da55604c319fd,No,Will Lori Vallow be convicted for the murder of her fourth husband on 14 December 2023?
0x58a49f622566315706ebb0d0b8948255da267246,Yes,"Will Donald Trump face criminal charges for actions he took as president by December 10, 2023?"
0x58cb4f276016f01aab7ec49d14ee9f8e3bb3d9cc,No,Will Spotify add full-length music videos to its app by 15 August 2023?
0x58cd9140a06c9e48550e0d76e828f9efdb1f5170,No,Will CD Projekt Red release a new game by 9 August 2023?
0x58d8e8ee2dcb4498e350a2e0ca6a1838495dba1e,No,Will the 9 deputies charged in the Memphis jail death be convicted by 28 September 2023?
0x58e7f0f2aa0867c61f1fc1b217634abdfa48544e,No,Will the Canon RF 10-20mm F4 L IS STM lens be released by 16 October 2023?
0x58f36d42cd590175bb034f07147e8af1ae8ce39e,Yes,Will there be another earthquake in western Afghanistan on 13 October 2023?
0x591c5148b37886b6c41410f342beab40cfacf929,No,Will Syngenta sell its 160 acres of farmland in Arkansas by 25 October 2023?
0x5926d6ebf9f8cdb90202082389385e80de2e03af,No,Will more information about the key ingredient for EVs under the former volcano be revealed by 6 September 2023?
0x5976d4441f6fea4d75b19146f841b3b951d42b25,No,Will there be a tribute concert for Smash Mouth's Steve Harwell by 12 September 2023?
0x59b224d04abb1b2091d0aa790efcf1ba384c02a7,Yes,Will Intel launch the Raptor Lake Refresh CPUs on 22 December 2023?
0x59b7d3dc768d8544eb4cbc847164c7357a778e57,Yes,Will the Switzerland gunman be captured by 18th December 2023?
0x59daa6711aabb88087ce231e61d8db2d3fe07101,No,Will Amazon's Echo Studio smart speaker still be on sale for $160 on 25 August 2023?
0x5a251a711f0c6452f4a8469fafa0c8fa890fbfec,No,Will Mark Zuckerberg and Elon Musk publicly reconcile their differences by 25 August 2023?
0x5a28e57197a8d36d8137634df42930161ad3a76d,Yes,Will Grubhub launch Amazon’s cashierless tech at colleges by 3 September 2023?
0x5a33e8ef00926309277cf913363ea0e7376f4ce8,No,Will the dispute between Egypt and Ethiopia over the Nile dam be resolved by 15 September 2023?
0x5a7c68b8a89301446cc698893d9fddafcb61d052,No,Will the Carolina Panthers win their next match on or by 5 December 2023?
0x5a806b060c9c0df83c4990b6eedf3437e754fc01,No,Will Blue Origin successfully launch a rocket without engine explosion on 8 August 2023?
0x5ab525a19eeccb23f40548307f4dd30be72a5eab,No,Will Arsenal lead the Premier League table on 3 January 2024?
0x5abd572ee98fbd1f8b4ae7f93a306c27578bac33,Yes,Will Digi's AI-powered chatbot and avatar system 'girlfriends' be commercially available by 1 January 2024?
0x5ad99641dc7c8ec1663743cb0d44838223ed2d5d,No,Will the white Kansas teen be tried on federal hate crime charges by 21 September 2023?
0x5ae4a561493ce1df4063097c347dc68231385eb2,No,Will NASA successfully implement the use of a giant inflatable bag for space junk collection by 10 September 2023?
0x5b12fe2c0b35c7f4959b55f495f81f16339709f7,No,Will the first phase of the Ram Temple in India's northern town of Ayodhya open to devotees by 20 September 2023?
0x5b3cec07c29d07829be9e03cfba3c06f8cc83e84,No,Will Selena Gomez and Benny Blanco announce a break up by 15 December 2023?
0x5b3de5d6eace610f241e4b02a2e581d13df07c7d,No,Will the Analogue's 4K Nintendo 64 be released by 23 October 2023?
0x5b4c59ca3e0df0811611987f1001f6c3f1ff0a55,Yes,Will the United Auto Workers union strike against major US car makers by 15 September 2023?
0x5b9e7ad1294631b7d7fe40aa133cd99db8f15792,No,Will Liz Cheney officially announce her third-party US presidential run by 18 December 2023?
0x5bc3141e5b19e123dee9ab5680de0fdf5daaeb4b,No,Will the Hollywood strikes end by 20 August 2023?
0x5bcb047bf6da62b1b7667779f831fc0618c9ebf6,No,Will Disney World Princess Week be celebrated again on 1 September 2023?
0x5bdc3169d6309851eedf7410128b1faddd49c807,No,"Will California implement a new law against caste discrimination on or before October 17, 2023?"
0x5bf1c9278a7eda940ba9a8b7f0dd21942795a0ba,No,Will Donald Trump win the New York business fraud case on or before 21 November 2023?
0x5bf928f5d3aa11c299659cdfee56ed9a2cc1f7b2,Yes,Will the Somerset family reach Australia without flying by 27 December 2023?
0x5c34483d3f392ab270436710a95faa4ac125933f,No,Will the new malaria vaccine be widely distributed by 8 October 2023?
0x5c389c8c54a093d51646b1458b4a06513e703d75,No,Will the Apple iPad Air with an M2 chip be released on or before 18 December 2023?
0x5c633e846c28c3b60e8de76a51b34a2e689c5441,Yes,Will Jill Biden recover from Covid-19 by 9 September 2023?
0x5cb53311b904a5a3e0ffc870575e64e92749d6ba,No,Will the Macy's workers in Washington state end their strike by 1 December 2023?
0x5ccf3560816d7996c8379e413e46d4b5f0bee377,Yes,Will the United Auto Workers union end its strike against Stellantis by 31 October 2023?
0x5d5dcff44157eb4042965e5950f7b6794e131d4a,No,Will the Samsung Galaxy Fit 3 be officially launched by 18 December 2023?
0x5d6d78a2f0471b35b747af394832ca90aa9d546b,No,Will Tottenham Hotspur maintain their lead at the top of the Premier League table by 3 November 2023?
0x5d76d2a8ecf5f5c565760cc4e6f3686b31404060,No,Will Iran officially declare support for the attack on Israel by 17 October 2023?
