id,currentAnswer,title
0x7956c2032ecbf5a2b314881abce9bebe8bdb0b76,No,Will Senator Joe Manchin officially announce his 2024 presidential run by 24 November 2023?
0x797e97e9ddb5d0f01054283073aeb941ae7b505a,No,Will the DAO vote AIP-2 in before the end of October 2023?
0x798544e88ba5a3f7b34282c5343a3f389ad19162,No,"Will OpenAI appoint Emmett Shear as its permanent CEO by November 27, 2023?"
0x7987ac9f013b2f7b803e9b2770d0837ab35c1671,No,Will the cease-fire between Hamas and Israel hold until 3 December 2023?
0x798bd20154b61f2fd394a344e9960cab6b1fc9f1,Yes,Will French authorities find a foreign link to the Star of David graffiti in Paris by 16 November 2023?
0x799e6f7f76d3b4849e68550a528a1b1f9b8e5076,Yes,Will the United States capture more key Islamic State militants by 30 September 2023?
0x7a4b9ac6a89a9984733f5eb455932696627a2836,No,Will the film director Terence Davies receive a posthumous award on or by 12 October 2023?
0x7acbe09c2d4a236bd123e826cc0acd0623fc07ce,Yes,Will Hibernian end their winless run in the Scottish Premiership by 13 November 2023?
0x7aedf8434f5da2f80b5cd0c22f918b7dc98ba2a7,Yes,Will the Epic v. Google lawsuit be resolved in favor of Epic Games by 18 December 2023?
0x7b10b7853318f3e177cae1f28405690908d4e165,No,Will the DOJ conclude its probe into Tesla's EV range exaggeration allegations on 2 November 2023?
0x7b4086241adc57029fc0dc6d8b43e9f5a63a2f3d,No,Will there be another glacial lake burst causing casualties in India by 11 October 2023?
0x7b47d7b80d481e6dcffee15b37f92fbc1254e7ca,No,Will Foxconn successfully sell its two large facilities in Wisconsin by 7th September 2023?
0x7b501a1cb4015944f1e93a7c4b180a9493b081fc,No,Will Romana Didulo be forced to leave the Canada town by 2 October 2023?
0x7b60c9c509c8e1a7fb0632edddb0ddeebf233941,No,Will Tesla deliver all pre-ordered Cybertrucks by 9 December 2023?
0x7b66a7a37eefda094e8cc19afceec2aca8aebcab,Yes,Will the Pope's call for a binding treaty to regulate artificial intelligence be realized by 20th December 2023?
0x7b6d844198e13be77e0c132961f0b34b9f6cc932,No,Will an eastern Pennsylvania candy factory face another explosion on or by 12 October 2023?
0x7bfdf6709ec46cf283431878a4c3b60fe9d61ad5,No,Will the UK government take stronger action against Beijing following the arrest of a parliamentary researcher by 15 September 2023?
0x7c0a5991b1192b04d88232f70911643a83e62fcd,Yes,Will Wix incorporate generative AI into its platform by 6 December 2023?
0x7c44ea42bd687cc37ac1c322b69fdeb0d39eacd7,No,"Will the verdict of JetBlue's Spirit merger be released by December 18, 2023?"
0x7d54fb2ba26557be610772c264f969db86d2f0f5,No,Will Gerry Turner and his chosen lady from 'The Golden Bachelor' get married on TV by 11 December 2023?
0x7d68c8571edf0a6f57bedaf598c54047c175e36a,Yes,Will Pope Francis attend any public events on 8 December 2023?
0x7dbf67359b918b7c7c6f8fd7f47de0598d0e92fa,No,Will Joe Biden be officially charged for mishandling classified documents on or by 15 October 2023?
0x7e2ad7cbd2492d9eed0fc56e99f0712c4301703a,No,Will the US Air Force complete the re-commissioning of the Pacific island airfield that launched the atomic bombings of Japan by 1 January 2024?
0x7e7ec7a4a8a157bbe1942390861ba60b4445a8ab,No,Will the Internet Archive lose its lawsuit to Sony and Universal by 21 August 2023?
0x7eceafc3672220aa80f8d9e3a5325418d0bc4a96,No,Will Foxconn's shares recover from the drop caused by the report of China tax audit and land use probe by 30 October 2023?
0x7ef9b2258bf293ac8d3e8b55755fbc860e4d5d90,No,Will the Hollywood writer's strike end by 25 September 2023?
0x7f3a29c451d3b9505d0265e428dccc30ff679c40,No,Will Amazon start making its own hydrogen to power vehicles by 6 January 2024?
0x7f4ec78ffb9ff4b2c1cdc58f5b3c170f3c509323,Yes,Will Russian President Vladimir Putin accept Kim Jong Un's invitation to visit North Korea by 18 September 2023?
0x7f69ef3825db9333eefb7886fb28b398eeafb684,Yes,Will President Joe Biden provide continued support to Ukraine on 6 October 2023?
0x7f6d09a8c26b1aff965b9c11cbdff4aefe5c11ca,Yes,Will the Universities of Wisconsin implement the pay raises-diversity deal on or by 20 December 2023?
0x7f8e15175e4ea0563a19fe76ce8f0c8c1c50d2ad,No,Will Elon Musk issue a public apology to Taiwan for his comments by 18 September 2023?
0x7f9f057ad7adc0500e01d2576d5e55643fd7549e,No,Will Microsoft's Edge Copilot AI be able to summarize every YouTube video by 18 December 2023?
0x7fd1143db301c1ad64934234428612d07d635966,No,Will Avi Loeb provide valid scientific proof for his claim of finding alien tech by 5 August 2023?
0x7fd1ac9ce76da6ac24f259c7f7fc8506ceba37e2,No,Will Rep. George Santos be expelled from the US House of Representatives by 4 November 2023?
0x804d5749dfc390f392888f90fd149c99e689447a,No,Will the Gold Coast reconsider and bid for the 2026 Commonwealth Games by 11 December 2023?
0x806147a8af4b687086bba64e4445c5cdf7a4977b,Yes,Will Liverpool win against Manchester United on 20 December 2023?
0x80a488565e3f0f9aaf99549cfe23e073ad5161e5,No,Will Ramzan Kadyrov's proposal to postpone the Russian presidential election be accepted by 13 October 2023?
0x8136168ca5b75ddad256e1496b3fbde3fc2e15b3,No,Will the red-bellied piranhas at Chester zoo attack any visitors by 14 August 2023?
0x815e881d0339966b19850779b642daba4a851e44,Yes,Will an impeachment inquiry be launched against President Joe Biden on or by 8 November 2023?
0x815f0e70ddc08070dc710cf446df4674ab40df86,No,Will Biden's alternative student loan forgiveness plan be implemented by 9 November 2023?
0x8187d4a834db8e358e70ea0ef4f860ad96d4165e,No,Will Lewis Hamilton move to Red Bull in the Formula 1 driver standings on 2 December 2023?
0x81d2f56011c16c5b8665a6ae64f400290b347824,Yes,Will the Biden administration successfully implement the modifications to the foster care system by 3 October 2023?
0x81f5e941b594c8df64a8c4b55b6c58471d54244f,No,Will Microsoft and the UK regulator resolve the Activision merger issues by 12 August 2023?
0x820370f9532b3b4d6cde5d9022e4bdfddba723d4,No,Will Geert Wilders become the Prime Minister of the Netherlands by 3rd December 2023?
0x8256aad7771abc71355c8508a3c24573ac2d461c,No,Will California Gov. Gavin Newsom officially announce his candidacy for the presidency by 3 November 2023?
0x82eda72104e1595fcc222002303cdf9e163dceee,Yes,Will the Minnesota Supreme Court rule in favor of Donald Trump being on the 2024 ballot by 13 November 2023?
0x82f9c3899e0aa8bd0584e51944ff96d7a3618555,Yes,"Will Cristiano Ronaldo score another goal in his career match on or before December 15, 2023?"
0x830328b33c1916bbb08c69439ebf4a9b1efb06a0,No,Will the peace plan discussed in Malta bring a resolution to the conflict in Ukraine by 6 November 2023?
0x8386648582dc8fca460b2e70a01fa0046e85363e,No,Will Netflix release a new movie from Zack Snyder on 9 September 2023?
0x8398bc89d1508056e0beadcd4feade38f9028ba8,Yes,Will the 10 Freeway in downtown L.A. be shut down due to a massive fire on 19 November 2023?
0x83dd9b5fcb1e3f2f83fb9e33913e8e164b3577a0,No,Will a new firm take over the Smile Direct Club customer base by 18 December 2023?
0x83f957cb7cc6bb5bb68b158aeda6972b831d52db,No,Will Spotify add full-length music videos to its app by 8 August 2023?
0x841350d87073208a2ac054fbd3c2023d13fe910a,No,Will the tension at the Israel-Lebanon border escalate into a war by 20 November 2023?
0x84202fa4cd3776535c705800ee9d8cdf48cf6354,No,"Will Neymar return to professional football after his ACL surgery by October 28, 2023?"
0x84296655f220a5c64ef94bd3a554d57b723c2077,No,Will Jonathan Majors be removed from the Marvel Cinematic Universe by 27 December 2023?
0x84415fb93f14016854050a0ad2f48ec18fc1f176,Yes,Will California's assault weapons ban still be in force on 5 November 2023?
0x845a1c4755bdfd1ef985fd7ab1977aabc6b213f6,No,Will Neuralink conduct its first human trials by 24 September 2023?
0x849ecc22b8b3872b1bb420e9f0b544baed3ae028,Yes,Will Thaksin Shinawatra be in jail by 2 September 2023?
0x84f85ec74e7acc41a6cf7d237aef79f3bcf596ef,Yes,Will the first transatlantic flight using 100% green fuels have been successfully completed by 4 December 2023?
0x8535ffac20a4ad14d4122be9be9b9be2b67de8a6,No,Will Hunter Biden be found guilty of the gun charges by 24 September 2023?
0x85868381b6b2839df9b47fa2a93f0b981610246f,No,Will Mitch McConnell retire from his position by 13 September 2023?
0x859d2e71475d851092449919034e56766ecfa77d,No,Will the UK special forces be found guilty of killing nine unarmed civilians in Afghanistan by 16 October 2023?
0x85cc26bb72e9a31e0a2445c11182bd9cd5790156,No,Will Ronnie O'Sullivan announce his retirement from professional snooker by 29 November 2023?
0x862fd88afe559c126265de4c4cf1388a129e1fc5,Yes,Will the FDA update Ozempic label to acknowledge some users’ reports of blocked intestines by 4 October 2023?
0x863c84e4774eeaaee80d0314b30bb633ae7baf2f,No,Will the investigation into the death of Canadian entrepreneur Daniel Langlois in Dominica conclude by 13 December 2023?
0x865b363a0f211fef797f4a771564d4bdff1dfda0,No,Will Jared Leto climb another iconic building on 18 November 2023?
0x865d2032bf5cdadc955197f8b0620d7d71ff1d10,No,Will the TV series 'Rebel Moon' release its first part before 19 November 2023?
0x8685ce261a7a7d2e373d4d975d278e5d5af5bd48,No,Will the 70 escaped crocodiles in southern China be recaptured by 16 September 2023?
0x86899fc5ef4185c9aa44acb456d3b1799138b896,No,Will Avi Loeb publish a new proof supporting his previous claim about alien tech by 18 August 2023?
0x86b8f251f5f3f2d93f66065c3cf2b77ec79b27f0,No,Will Dropbox offer unlimited cloud storage to new customers again on 1 September 2023?
0x870553a0e5e7a6c01ba326c6de320fe0ef498f84,No,Will the Bored Ape Yacht Club still be blocking OpenSea in the fight over payments on 25 August 2023?
0x87461bad728f26410bac883803920fdde2aca3e8,Yes,Will the Claude Monet painting fetch more than $65 million at the auction on 10 November 2023?
0x876f563ab747a5fdb009a02df42fdb2b111b9dda,No,Will the man claiming false arrest due to misuse of facial recognition technology win his lawsuit by 8 October 2023?
0x8773e95d319d3eea626dc20d7d61364072bf3fe8,Yes,Will Scottie Scheffler win another PGA Player of the Year award on 9 January 2024?
0x87a025956e11332ae90a3b012b8c2aec952c9879,No,Will the 'pink tax' on women's health care be addressed or removed by 6 October 2023?
0x87c43ecb89b516f9f65f357432199dafa047b7d6,No,Will the Custer County triple homicide suspect be convicted by 1 December 2023?
0x880cb7bc47da95bfd21e1967ccdd6a084337e498,No,Will Snoop Dogg maintain his decision to quit smoking weed by 25 November 2023?
0x881488933b9fcfd66c487121f208ae098d125e3d,No,Will Syrian President Bashar al-Assad successfully exit from diplomatic isolation by 28 September 2023?
0x88844d0e24754d3e314127e73f772ba724503f35,Yes,"Will Hunter Biden be subpoenaed in Joe Biden impeachment inquiry by November 6, 2023?"
0x8885cf72e59a6e75b996bc9f0f4697eb471b6ff9,No,Will the US government shut down due to financial issues on 3 October 2023?
0x88dfa459180684ab951e23c59255fea8d2f89836,No,Will the CEO of Web Summit retract his apology for comments on the Israel-Hamas war by 27 October 2023?
0x898827b92b9b5d4abe090bd25367d68a4922bccd,No,Will the Indian authorities successfully rescue the workers trapped inside the collapsed tunnel in the Indian Himalayas on or by 26 November 2023?
0x89c88c7a603f70560e7ddb77ad21392edcac049b,No,Will California increase the minimum paid sick leave days beyond five by 9 October 2023?
0x89ddd475e76f4a749ff9d280f68066eafaa2c1b4,No,Will Twitter release more data to the January 6 investigation by 24 August 2023?
0x89ee44f72981e8654f04c6882e556bab3b06fdc4,Yes,Will a tsunami hit the Northwest of United States before 22 December 2023 according to FEMA's Risk Analysis?
0x8a556a1e97e36e572d014731003fda7413518acc,No,Will there be more protests in Iran leading to arrests by 8 September 2023?
0x8a6fcf35e5e0f6f747eeea3d15e4b91bde2aa51f,Yes,Will Singapore's economy show growth in the first quarter of 2024?
0x8a91435f17c00530dac8008b8469e2fa21379392,No,Will Dropbox introduce a new cloud storage plan by 3 September 2023?
0x8aea05e1b273ebc3cb262418459f7b9c3d41bc4b,Yes,Will Rally's and Checkers continue to use AI chatbots for Spanish-language food orders on 25 August 2023?
0x8af62bfe082d5d202c9058eeffc86a9e5c743639,No,Will Microsoft Excel launch a rebranding campaign on 6 August 2023?
0x8af99dcbda8725a28b7bb432e141e4be3005e02d,Yes,Will the bird flu outbreak at the Ohio farm be fully contained by 3 December 2023?
0x8afa3ea60b16a563d0265f00d6726b0601cc35a2,Yes,Will Chrome introduce another security-related update by 25 August 2023?
0x8b48c26efb56cff207293eaa7b0fde168f7a8178,No,Will Ivanka Trump testify in Donald Trump's civil trial by 4 November 2023?
0x8b4cbb885249a8d5ca445c884cedc3dacd1e22f9,No,Will Andy Farrell be appointed as the British and Irish Lions head coach by 8 November 2023?
0x8b6bc2a8f4cadd294b68dd43c39c394fe97b6d37,Yes,Will Jenson Button win a race in the World Endurance Championship on 24 December 2023?
0x8b7aa84e50309a02c410707426acab43ce7bbac9,No,Will the lawsuit filed by Genesis against Gemini be settled by 30 November 2023?
0x8bb8023c5890ddb3084e96a42983e7f036954326,Yes,Will the Gaza hostages be released by 1 December 2023?
0x8bc177d20495285ab72f5c863312859272829a10,No,Will there be a significant breakthrough in the analysis of asteroid Bennu samples by 29 September 2023?
0x8bc4817099d994f88437050d6e2f483d202c2cd1,Yes,Will Hyundai's AI-powered smart factory be operational by 30 November 2023?
0x8c22c712eec356e91e1f6d5f0b5a61d6b6342258,Yes,Will the hostage situation at Hamburg airport be resolved by 12 November 2023?
0x8c36770e378d22e751ac0ffed3ffd1145f2f542d,No,"Will Volvo's electric cars in the US, Canada and Mexico start using Tesla's North American Charging Standard by 5 August 2023?"
0x8c4d4c502a8f93fc0657bae3469c157da0933373,No,Will another artefact be stolen from the British Museum on or before 28 August 2023?
0x8cdce5404f1f4f45da9aa2630c9d09a274c04a34,Yes,Will the trial of the Alabama man accused of the 1988 killing conclude with a verdict on 4 January 2024?
0x8cec9bbe210c8f416799396029912f9895a3aa34,Yes,Will MrBeast remain the world's biggest YouTuber by 14 August 2023?
0x8cfaec692ff8f4e5a6c686cce7f2e98e0ce5d7a7,No,Will the Chinese EV giant BYD exceed their 2023 vehicle sales by 8 January 2024?
0x8d072e0329a258e20f6ae3032d32f32485ea7b36,No,Will Google's new geothermal energy project expand to additional locations by 7 December 2023?
0x8d3a761825dea5754961ebb3f7455f645e7bdcc5,No,Will the Bank of England hike interest rates again on or before 22 September 2023?
0x8d5224265a91886ee76dfcd2f94416b9882e3b70,No,"Will Netflix fill the $900,000 AI job role by 5 August 2023?"
0x8d608ff5909e505e459d667cbebdea62003899fa,No,Will the missing Titanic sub be rescued by 2023-08-20?
0x8da8f5be9f0c3d213889f4add0858368081d57ef,Yes,Will the 2023 Ryder Cup see any controversy related to player compensation by 18 October 2023?
0x8dacca2827e4d222d99200c4db4a63e77ac4bcd8,Yes,Will Bronny James play another college basketball game by 18 December 2023 after his cardiac arrest?
0x8dc7b2f183ffcca9ffc079e97966dd76e769014a,No,"Will Donald Trump be officially disqualified from running for presidency by November 5, 2023?"
0x8dde1ac019877fbcdaf16797e1d8a8acf37e5f18,No,Will Sony sell over 50 million PlayStation 5 consoles on or by 11 August 2023?
0x8e023fd94b20f48a5e1443d3a14571243819f5aa,Yes,Will Tesla's EV charging plugs become the industry standard in the United States by 28 December 2023?
0x8e03407d94992678554515912f9312ba09d7549d,No,Will Javier Milei implement his proposed economic 'shock treatment' in Argentina by 18 December 2023?
0x8e658f1c91bddaa6006efa3454eb38a9ec80b444,Yes,Will the Universities of Wisconsin reach an agreement on the employee pay raise-diversity deal by 18 December 2023?
0x8e6b355502fb255e209bae0ddaa2daf6fcc37a54,No,Will there be another earthquake in Bangladesh with a magnitude of 5.5 or higher on 10 December 2023?
0x8e73c621f2b58864732e6fb8407605a2fa117beb,Yes,Will the Meta 'Super Rumble' game have over 1 million active players on 15 August 2023?
0x8ed8de219f460efcb73b6deaad65e0a6ea36d05f,No,Will the proposed additional 10% tax on diesel vehicles in India be approved by 16 September 2023?
0x8f4d840fb1ab956d82d691e98d2ec32e4a928f87,No,Will a trailer for Grand Theft Auto 6 be released by 13 November 2023?
0x8f591360ce34c36e3d8191bcd25b96f99e31596f,No,Will Donald Trump be convicted for his role in election fraud by the 2 September 2023?
0x8f6123201f643824bf270f00b8a44b628ec81cc7,No,Will Russian and North Korean military cooperation be officially confirmed by 19 September 2023?
0x8f644e742ae5758ed404544ebc78b3c270622988,Yes,Will the suspected grizzly bear responsible for the two deaths in Canada's Banff National Park be found by 11 October 2023?
0x8f6f6fe54fb7a5ff869d3b53386131de9de4b7d3,No,Will Sancho's extradition be requested by 23 September 2023?
0x8f81d584709cff1389861417d80e4d6607c42756,No,Will the Vatican officially bless same-sex unions by 7 October 2023?
0x8fc1e9cf4d997e7c9ccbab7cd15e34cadd25573a,No,Will the DAO vote AIP-2 in before the end of October 2023?
0x906c2c35fd3c5831dc2f19023e560d866195aebc,Yes,Will Meta's 'Quests' feature in Horizon Worlds increase user engagement by 20% by end of 2023?
0x90a53ebc8c7f5cb0f35922b21366b84f81b8eb78,No,Will the acquisition of Hawaiian Holdings by Alaska Air Group be completed by 12 December 2023?
0x90fd25b68a7762e995e37bd0fba50224600bc265,No,Will the new G7 guidelines for AI developers be released by 13 October 2023?
0x910c98df9457ee0c992dbe5ed0c57ade64187389,No,Will the Hollywood strikes end on or before 12 August 2023?
0x913b00edd42751b952d679b285d9822f36914018,Yes,Will Amazon Prime Day have another air fryer deal on 3 August 2023?
0x919f95cd9996c2e62358c3fecf7529d614647b9f,Yes,Will Michael Cohen testify against Donald Trump in the fraud trial on 2 November 2023?
0x91bab95d0f5ed0f1e903fde98f3230e8fd676f57,Yes,Will Taylor Swift's movie pre-sales surpass Marvel's by 12 September 2023?
0x91df3a629df15e0893e0d482c71f4af73a5d163a,No,Will the European Union present a report about Ukraine's progress in Kyiv on 12 November 2023?
0x9203dc88d10c1acf2a0c97515d7e86635101d5ff,No,Will a ceasefire be established between Israel and Gaza by 19 December 2023?
0x92286cb9bb116dbce43480657365b3127a8f0d17,Yes,Will the two Missouri men charged with assaulting police officers during the U.S. Capitol riot be convicted by 6 November 2023?
0x9230c551b8ab1256534b9778c7e5e90c2e780a0d,Yes,Will Donald Trump announce his candidacy for the 2024 presidency on 25 December 2023?
0x925f644d405d6c0dae4746ae6e3d32def3ee75ff,No,Will Sam Bankman-Fried be convicted in his criminal fraud trial by 1 November 2023?
0x9260545ac15a35b3ee631bc452efa61250cca0f6,No,Will Japan's Prime Minister Fumio Kishida implement an income tax cut for households and corporate tax breaks on or by 30 October 2023?
0x926b806ab06d373e8c16f3eb0d5187b181f0bba3,Yes,"Will the strike at Kaiser Permanente, the largest health care worker strike in US history, end by 11 October 2023?"
0x9275edb9e69f7cb419724b0b80f7e9195c912946,No,Will there be a volcanic eruption in southwestern Iceland on or by 23 November 2023?
0x92a26ddb3f8b56cecf0c2c34fc6ae031b4136697,Yes,Will Netflix remove the 'CoComelon Lane' episode facing backlash over a crossdressing boy scene by 27 December 2023?
0x92bb9a78a2fa7d5f360ca0794e61c7d2fc1e43f5,Yes,Will Amazon Alexa's integration with IFTTT cease to function by 31 October 2023?
0x92bca6775678e9e8b158a768aee72a0d6db1e1b2,No,Will the James Webb space telescope discover another active supermassive black hole on 2 August 2023?
0x92c595a24c03e3d970828c1dfae062fbf3f5ee64,No,Will Disney announce a new addition to the Disney Bundle on 30 August 2023?
0x930fec3b6cc597dcc5cc33f561f638b5fde28af2,No,Will there be a significant increase in climate-related disasters in China by 3 September 2023?
0x9311084dd48e46605996c8aa41cf9ceb04ee1124,No,Will Twitter have released Donald Trump's DMs by 23 August 2023?
0x931468ede251242344cc4f860e183482fe5c840c,No,Will Uefa president Aleksander Ceferin change his own rule to remain in power until 2031 before 18th December 2023?
0x931b8c49b55e8bbe9078e2aadc620488abed55ec,No,"Will Ford Motor Co. resume construction of its Michigan battery plant by September 30, 2023?"
0x934420ba976ffce845fb438b506f6d1720f6e413,No,Will there be any further unrest at Eritrean cultural festivals in Germany by 21 September 2023?
0x934bdeead5d3b7fbfdf42cfba5190124dce6e9e4,Yes,Will the Federal Reserve cut interest rates by 21 December 2023?
0x9386575d5c746c11c5bc301dc2fb17a9487d2e9d,No,Will there be a major aftershock (6.0 or above) following the 6.2-magnitude earthquake in northern Chile on or by 14 September 2023?
0x93c9cfedf377c436ba495b91bda8b68ab41e1879,No,Will a new Indie game be released on Nintendo Switch on 19 August 2023?
0x9427290807ebca579def8b206ae62258e20c2a85,No,Will Samsung release another QD-OLED TV model by 14 August 2023?
0x945aaed085ca00c9118eb14a87d9dbf40042584b,Yes,Will the Met Gala reveal their 2024 theme on 15 November 2023?
0x946bf5adc0794e264ef9a175272d6f1d0c560367,No,Will AI be successfully used to decode whale communication by 3 September 2023?
0x950845db39755f4f0f94e7d718e1a5ea23e0ca25,No,Will Samsung launch a new generation of foldable phones at the Unpacked 2023 event on 7 August 2023?
0x9554c47ff8fd8e2b67bb98a9bb23ce901a2df814,Yes,Will Russia intensify attacks against Ukraine military targets on 6 January 2024?
0x955509b8d6954a2716788e2aa413e7cbda5fe9b2,Yes,Will the film adaptation of Hideo Kojima's Death Stranding videogame be released on 22 December 2023?
0x956973bba2e6b5e55ac6f6c72b6f8bcc8238bada,Yes,Will Sergio Ramos return to Sevilla be officially recognized on 14 September 2023?
0x957a524acac3051cf48babb62098040f4ef0339c,No,Will the astronomical observatories shut down by hackers be operational again by 6 September 2023?
0x95a8ebab53f636e011aeb252c1edbd2379241acd,No,Will the match between RKC Waalwijk and Ajax be resumed by 5 October 2023?
0x95c6bc84452879b03dd82a74eb749fd01afa84d4,No,Will Kevin McCarthy lose his job as Speaker on 27 September 2023?
0x96359fae3417c5dd8eaa2ab5f5366b6ef3609066,No,Will Honda announce a follow-up model to the Honda E compact electric car by 8 August 2023?
0x9653f0e09bbf77e75b71d2c6b4295d8585276678,No,Will the strike by United Auto Workers end on or before 14 October 2023?
0x96c1653855fa3aa56d60357f75a93bc981cd1e35,No,Will Southwest Airlines change its boarding policies again by 4 September 2023?
0x96e7e8ff504a32d149d5735ea1cd4802b4708172,Yes,Will the Turkish MP who suffered a heart attack during a tirade against Israel return to the parliament by 20 December 2023?
0x96fb8e5893e658d818841a15ae7a1fa234a47dee,No,Will there be another tornado or severe storm in Tennessee by 18 December 2023?
0x971ea2c19ec86978b8b877fb1eb3009f5c1728bb,No,Will Cristiano Ronaldo score more than 50 goals in total by 17 December 2023?
0x977f7f25e91fb2c0ec09be082d82e027d3174031,Yes,Will Unity appoint a new CEO by 16 October 2023?
0x97dc9aea8adc8eeb131c51fc69d1f397acc37002,No,Will Verizon announce a major upgrade to rural 5G on 19 August 2023?
0x97fa5002d5486bf861658385dad4e520802db845,No,Will the Los Angeles sheriff's deputy who was shot in Palmdale recover from his injuries by 22 September 2023?
0x9806852acd6e68c9154a68f5010cbbfa539a1410,No,Will Twitter resolve its bot problem by 11 September 2023?
0x9829cfe469e7d135b8ecc443de215c8370871e12,Yes,Will Charles Martinet officially step away from voicing Mario in games by 29 August 2023?
0x98728b160b8c5181752f57e385e12d98ada3778b,No,Will the United Auto Workers union approve the tentative pay deal with Stellantis by 7th November 2023?
0x98d4f1af2b41f11b6dc669e3def8ac3bee5d9214,Yes,Will a verdict be reached in Hunter Biden's California tax case by 28 December 2023?
0x98d6e90bdbd7446cce02721164d459800d73ffda,No,Will Verizon offer a combined $10 streaming bundle with Netflix and Max by 19 November 2023?
0x99cffa474afc1a5809ae54cb0edd3b0266e6eccd,No,Will the Web Summit appoint a new CEO by 27 October 2023?
0x9a869451c797b7ff5b76b3f66f8056abf56b5333,No,Will Kevin McCarthy be reinstated as US House Speaker by 18 October 2023?
0x9aa3620fe2ec09bd98e74f4aa2d8d6be844c05b4,Yes,Will Tesla start supporting third-party apps by 23 October 2023?
0x9abd48be2e07ab27202ee7d6b17013d4867c3afb,Yes,Will the US seize more illegal e-cigarettes on 6 January 2024?
0x9ae6047d3b781000138435c015e4f8aa67f8f006,Yes,Will Alibaba Cloud recover from its service outage by 4 December 2023?
0x9b28d4e8a1cbeec2b54025114f92b18c59647670,Yes,Will the iPhone 15 Pro overheating issue be fixed by 6 October 2023?
0x9b7b3e8d212aa6c70962e483a68c459c4c0b780f,No,Will there be a ceasefire in the Israel-Hamas conflict by 9 November 2023?
0x9b9583e62978707e2b1ff5a35002e68ae3c1f15a,Yes,Will Samsung SDI's deal to supply EV batteries to Hyundai Motor be officially confirmed by 29 October 2023?
0x9bacc284cda728242ac6911b82230533bdbbc4b5,Yes,Will the Powerball lottery's jackpot exceed $700 million on 4 January 2024?
0x9be1cf6f17f3951520b3072e6f7b6adc456b5a74,Yes,"Will the release of 'Alan Wake II' be delayed until after August 25, 2023?"
0x9bf56d7ef09a3d7c9c7cc7223828b42047f19a3f,Yes,Will Google Drive implement the announced changes by 8 December 2023?
0x9c1b36a636d7636a0cfdd614a83730b464597b65,Yes,Will China's President Xi Jinping conclude his visit to the United States on or by 24 November 2023?
0x9c44f09cf6b2f03720c064628715d16192ac2971,Yes,Will the Liverpool Football Club demand consequences for a false VAR decision by 6 October 2023?
0x9cbbfc88ba78ec31d612a926e6388013cb05ee76,Yes,Will Amazon Prime Video begin showing ads by 5 January 2024?
0x9d13267b36fdfce3c6a4b69da88eec67b5e64b03,No,Will GTA 6 be released on or before 26 October 2023?
0x9d3ebb45f87d3dce0f7a1310bcf5936f228ef16a,Yes,Will a new innovation for cooling windowless rooms be announced on or before 3 August 2023?
